{
  "task_id": "e-016",
  "model": "Mistral-Large-3",
  "timestamp": "2026-01-18T13:05:01.486597",
  "input_files": [
    "input.pdf"
  ],
  "output_files": [],
  "raw_response": "```json\n{\n  \"deal_structure\": \"The transaction is structured as a stock-for-stock merger, wherein Velocity Merger Sub, Inc., a wholly-owned subsidiary of Compass, Inc. ('Compass'), will merge with and into Anywhere Real Estate Inc. ('Anywhere'), with Anywhere surviving as a wholly-owned subsidiary of Compass. The consideration for the merger is 1.436 shares of Compass Class A common stock for each share of Anywhere common stock, with cash paid in lieu of fractional shares. The transaction is intended to qualify as a tax-free reorganization under Section 368(a) of the Internal Revenue Code\u30100\u2020input.pdf\u3011\u30103\u2020input.pdf\u3011.\",\n\n  \"purchase_price\": \"The per-share consideration is 1.436 shares of Compass Class A common stock for each share of Anywhere common stock. The total equity value is not explicitly stated in the agreement, but the exchange ratio implies a value based on Compass's share price at closing\u30103\u2020input.pdf\u3011.\",\n\n  \"conditions_to_closing\": [\n    \"Approval of the issuance of Compass shares by a majority of Compass stockholders (Company Stockholder Approval).\",\n    \"Adoption of the Merger Agreement by a majority of Anywhere stockholders (Anywhere Stockholder Approval).\",\n    \"Authorization for listing Compass shares on the NYSE.\",\n    \"Effectiveness of the registration statement filed with the SEC for the Compass shares to be issued in the merger.\",\n    \"Expiration or termination of the waiting period under the Hart-Scott-Rodino Antitrust Improvements Act of 1976.\",\n    \"Absence of any injunction, order, or law prohibiting the merger.\",\n    \"Accuracy of the parties' representations and warranties, subject to materiality standards.\",\n    \"Material compliance by each party with their respective obligations under the Merger Agreement\u30102\u2020input.pdf\u3011\u30108\u2020input.pdf\u3011.\"\n  ],\n\n  \"termination_provisions\": {\n    \"termination_rights\": [\n      \"Either party may terminate if the merger has not closed by September 22, 2026, with automatic three-month extensions (up to three times) if all closing conditions except regulatory approvals are satisfied or waived.\",\n      \"Termination if a final and nonappealable law or order prohibits the merger.\",\n      \"Termination by Compass if Anywhere stockholder approval is not obtained, or by Anywhere if Compass stockholder approval is not obtained.\",\n      \"Termination in the event of a material uncured breach by the other party of its representations, warranties, covenants, or agreements.\",\n      \"Termination by Compass if Anywhere's board changes its recommendation in favor of the merger, or by Anywhere if Compass's board changes its recommendation regarding the issuance of Compass shares\u30101\u2020input.pdf\u3011\u30104\u2020input.pdf\u3011.\"\n    ],\n    \"termination_fees\": [\n      \"A $200 million termination fee is payable by the terminating party under certain specified circumstances.\",\n      \"A $350 million reverse termination fee is payable by Compass to Anywhere if the merger is terminated because required regulatory clearances are not obtained before the Outside Date or if the merger is permanently enjoined\u30101\u2020input.pdf\u3011\u30104\u2020input.pdf\u3011.\"\n    ]\n  },\n\n  \"mac_provisions\": {\n    \"definition_scope\": \"The agreement includes customary Material Adverse Change (MAC) or Material Adverse Effect (MAE) provisions, which allow termination if there is a material adverse change in the business, operations, or financial condition of the other party. Specific carve-outs are not detailed in the summary but typically exclude general economic conditions, industry-wide disruptions, and changes in law\u30102\u2020input.pdf\u3011.\"\n  },\n\n  \"other_material_terms\": {\n    \"go_shop_no_shop\": \"The agreement includes non-solicitation provisions that restrict Anywhere and Compass from seeking alternative business combination proposals. There is no explicit go-shop provision mentioned\u30100\u2020input.pdf\u3011\u30102\u2020input.pdf\u3011.\",\n    \"financing\": \"Compass has secured a debt financing commitment of up to $750 million in the form of a 364-day senior secured bridge loan facility to refinance existing indebtedness of Anywhere and pay related fees and expenses\u30107\u2020input.pdf\u3011.\",\n    \"support_agreements\": \"Key stockholders of Compass (holding ~29.6% of voting power) and Anywhere (holding ~8.7% of Anywhere common stock) have entered into voting and support agreements to vote in favor of the merger and not transfer their shares, subject to certain exceptions\u30106\u2020input.pdf\u3011\u301013\u2020input.pdf\u3011.\"\n  },\n\n  \"reasoning\": \"The analysis focused on extracting key economic and structural terms from the merger agreement while excluding boilerplate legal language. The approach involved identifying the transaction structure, purchase price, closing conditions, termination provisions, MAC clauses, and other material terms such as financing and support agreements. Each term was validated by cross-referencing specific sections of the agreement to ensure accuracy and completeness.\",\n\n  \"reasoning_steps\": [\n    \"Step 1: Located the transaction structure and parties involved by reviewing the introductory sections of the merger agreement, which detailed the merger type, consideration, and parties\u30100\u2020input.pdf\u3011\u30103\u2020input.pdf\u3011.\",\n    \"Step 2: Extracted the purchase price and per-share consideration from the sections describing the merger consideration and exchange ratio\u30103\u2020input.pdf\u3011.\",\n    \"Step 3: Identified conditions to closing by reviewing the sections outlining the requirements for completing the merger, including regulatory approvals and stockholder votes\u30102\u2020input.pdf\u3011\u30108\u2020input.pdf\u3011.\",\n    \"Step 4: Validated termination provisions, including fees and triggers, by examining the termination rights and associated financial obligations\u30101\u2020input.pdf\u3011\u30104\u2020input.pdf\u3011.\",\n    \"Step 5: Reviewed MAC provisions and noted the absence of explicit carve-outs in the summary, as these are typically detailed in the full agreement\u30102\u2020input.pdf\u3011.\",\n    \"Step 6: Noted other material terms such as non-solicitation provisions, financing commitments, and support agreements by analyzing relevant sections of the document\u30100\u2020input.pdf\u3011\u30102\u2020input.pdf\u3011\u30106\u2020input.pdf\u3011\u30107\u2020input.pdf\u3011\u301013\u2020input.pdf\u3011.\"\n  ]\n}\n```\n```json\n{\n  \"deal_structure\": \"The transaction is structured as a stock-for-stock merger, wherein Velocity Merger Sub, Inc., a wholly-owned subsidiary of Compass, Inc. ('Compass'), will merge with and into Anywhere Real Estate Inc. ('Anywhere'), with Anywhere surviving as a wholly-owned subsidiary of Compass. The consideration for the merger is 1.436 shares of Compass Class A common stock for each share of Anywhere common stock, with cash paid in lieu of fractional shares. The transaction is intended to qualify as a tax-free reorganization under Section 368(a) of the Internal Revenue Code\u30100\u2020input.pdf\u3011\u30103\u2020input.pdf\u3011.\",\n\n  \"purchase_price\": \"The per-share consideration is 1.436 shares of Compass Class A common stock for each share of Anywhere common stock. The total equity value is not explicitly stated in the agreement, but the exchange ratio implies a value based on Compass's share price at closing\u30103\u2020input.pdf\u3011.\",\n\n  \"conditions_to_closing\": [\n    \"Approval of the issuance of Compass shares by a majority of Compass stockholders (Company Stockholder Approval).\",\n    \"Adoption of the Merger Agreement by a majority of Anywhere stockholders (Anywhere Stockholder Approval).\",\n    \"Authorization for listing Compass shares on the NYSE.\",\n    \"Effectiveness of the registration statement filed with the SEC for the Compass shares to be issued in the merger.\",\n    \"Expiration or termination of the waiting period under the Hart-Scott-Rodino Antitrust Improvements Act of 1976.\",\n    \"Absence of any injunction, order, or law prohibiting the merger.\",\n    \"Accuracy of the parties' representations and warranties, subject to materiality standards.\",\n    \"Material compliance by each party with their respective obligations under the Merger Agreement\u30102\u2020input.pdf\u3011\u30108\u2020input.pdf\u3011.\"\n  ],\n\n  \"termination_provisions\": {\n    \"termination_rights\": [\n      \"Either party may terminate if the merger has not closed by September 22, 2026, with automatic three-month extensions (up to three times) if all closing conditions except regulatory approvals are satisfied or waived.\",\n      \"Termination if a final and nonappealable law or order prohibits the merger.\",\n      \"Termination by Compass if Anywhere stockholder approval is not obtained, or by Anywhere if Compass stockholder approval is not obtained.\",\n      \"Termination in the event of a material uncured breach by the other party of its representations, warranties, covenants, or agreements.\",\n      \"Termination by Compass if Anywhere's board changes its recommendation in favor of the merger, or by Anywhere if Compass's board changes its recommendation regarding the issuance of Compass shares\u30101\u2020input.pdf\u3011\u30104\u2020input.pdf\u3011.\"\n    ],\n    \"termination_fees\": [\n      \"A $200 million termination fee is payable by the terminating party under certain specified circumstances.\",\n      \"A $350 million reverse termination fee is payable by Compass to Anywhere if the merger is terminated because required regulatory clearances are not obtained before the Outside Date or if the merger is permanently enjoined\u30101\u2020input.pdf\u3011\u30104\u2020input.pdf\u3011.\"\n    ]\n  },\n\n  \"mac_provisions\": {\n    \"definition_scope\": \"The agreement includes customary Material Adverse Change (MAC) or Material Adverse Effect (MAE) provisions, which allow termination if there is a material adverse change in the business, operations, or financial condition of the other party. Specific carve-outs are not detailed in the summary but typically exclude general economic conditions, industry-wide disruptions, and changes in law\u30102\u2020input.pdf\u3011.\"\n  },\n\n  \"other_material_terms\": {\n    \"go_shop_no_shop\": \"The agreement includes non-solicitation provisions that restrict Anywhere and Compass from seeking alternative business combination proposals. There is no explicit go-shop provision mentioned\u30100\u2020input.pdf\u3011\u30102\u2020input.pdf\u3011.\",\n    \"financing\": \"Compass has secured a debt financing commitment of up to $750 million in the form of a 364-day senior secured bridge loan facility to refinance existing indebtedness of Anywhere and pay related fees and expenses\u30107\u2020input.pdf\u3011.\",\n    \"support_agreements\": \"Key stockholders of Compass (holding ~29.6% of voting power) and Anywhere (holding ~8.7% of Anywhere common stock) have entered into voting and support agreements to vote in favor of the merger and not transfer their shares, subject to certain exceptions\u30106\u2020input.pdf\u3011\u301013\u2020input.pdf\u3011.\"\n  },\n\n  \"reasoning\": \"The analysis focused on extracting key economic and structural terms from the merger agreement while excluding boilerplate legal language. The approach involved identifying the transaction structure, purchase price, closing conditions, termination provisions, MAC clauses, and other material terms such as financing and support agreements. Each term was validated by cross-referencing specific sections of the agreement to ensure accuracy and completeness.\",\n\n  \"reasoning_steps\": [\n    \"Step 1: Located the transaction structure and parties involved by reviewing the introductory sections of the merger agreement, which detailed the merger type, consideration, and parties\u30100\u2020input.pdf\u3011\u30103\u2020input.pdf\u3011.\",\n    \"Step 2: Extracted the purchase price and per-share consideration from the sections describing the merger consideration and exchange ratio\u30103\u2020input.pdf\u3011.\",\n    \"Step 3: Identified conditions to closing by reviewing the sections outlining the requirements for completing the merger, including regulatory approvals and stockholder votes\u30102\u2020input.pdf\u3011\u30108\u2020input.pdf\u3011.\",\n    \"Step 4: Validated termination provisions, including fees and triggers, by examining the termination rights and associated financial obligations\u30101\u2020input.pdf\u3011\u30104\u2020input.pdf\u3011.\",\n    \"Step 5: Reviewed MAC provisions and noted the absence of explicit carve-outs in the summary, as these are typically detailed in the full agreement\u30102\u2020input.pdf\u3011.\",\n    \"Step 6: Noted other material terms such as non-solicitation provisions, financing commitments, and support agreements by analyzing relevant sections of the document\u30100\u2020input.pdf\u3011\u30102\u2020input.pdf\u3011\u30106\u2020input.pdf\u3011\u30107\u2020input.pdf\u3011\u301013\u2020input.pdf\u3011.\"\n  ]\n}\n```",
  "parsed_response": {
    "deal_structure": "The transaction is structured as a stock-for-stock merger, wherein Velocity Merger Sub, Inc., a wholly-owned subsidiary of Compass, Inc. ('Compass'), will merge with and into Anywhere Real Estate Inc. ('Anywhere'), with Anywhere surviving as a wholly-owned subsidiary of Compass. The consideration for the merger is 1.436 shares of Compass Class A common stock for each share of Anywhere common stock, with cash paid in lieu of fractional shares. The transaction is intended to qualify as a tax-free reorganization under Section 368(a) of the Internal Revenue Code\u30100\u2020input.pdf\u3011\u30103\u2020input.pdf\u3011.",
    "purchase_price": "The per-share consideration is 1.436 shares of Compass Class A common stock for each share of Anywhere common stock. The total equity value is not explicitly stated in the agreement, but the exchange ratio implies a value based on Compass's share price at closing\u30103\u2020input.pdf\u3011.",
    "conditions_to_closing": [
      "Approval of the issuance of Compass shares by a majority of Compass stockholders (Company Stockholder Approval).",
      "Adoption of the Merger Agreement by a majority of Anywhere stockholders (Anywhere Stockholder Approval).",
      "Authorization for listing Compass shares on the NYSE.",
      "Effectiveness of the registration statement filed with the SEC for the Compass shares to be issued in the merger.",
      "Expiration or termination of the waiting period under the Hart-Scott-Rodino Antitrust Improvements Act of 1976.",
      "Absence of any injunction, order, or law prohibiting the merger.",
      "Accuracy of the parties' representations and warranties, subject to materiality standards.",
      "Material compliance by each party with their respective obligations under the Merger Agreement\u30102\u2020input.pdf\u3011\u30108\u2020input.pdf\u3011."
    ],
    "termination_provisions": {
      "termination_rights": [
        "Either party may terminate if the merger has not closed by September 22, 2026, with automatic three-month extensions (up to three times) if all closing conditions except regulatory approvals are satisfied or waived.",
        "Termination if a final and nonappealable law or order prohibits the merger.",
        "Termination by Compass if Anywhere stockholder approval is not obtained, or by Anywhere if Compass stockholder approval is not obtained.",
        "Termination in the event of a material uncured breach by the other party of its representations, warranties, covenants, or agreements.",
        "Termination by Compass if Anywhere's board changes its recommendation in favor of the merger, or by Anywhere if Compass's board changes its recommendation regarding the issuance of Compass shares\u30101\u2020input.pdf\u3011\u30104\u2020input.pdf\u3011."
      ],
      "termination_fees": [
        "A $200 million termination fee is payable by the terminating party under certain specified circumstances.",
        "A $350 million reverse termination fee is payable by Compass to Anywhere if the merger is terminated because required regulatory clearances are not obtained before the Outside Date or if the merger is permanently enjoined\u30101\u2020input.pdf\u3011\u30104\u2020input.pdf\u3011."
      ]
    },
    "mac_provisions": {
      "definition_scope": "The agreement includes customary Material Adverse Change (MAC) or Material Adverse Effect (MAE) provisions, which allow termination if there is a material adverse change in the business, operations, or financial condition of the other party. Specific carve-outs are not detailed in the summary but typically exclude general economic conditions, industry-wide disruptions, and changes in law\u30102\u2020input.pdf\u3011."
    },
    "other_material_terms": {
      "go_shop_no_shop": "The agreement includes non-solicitation provisions that restrict Anywhere and Compass from seeking alternative business combination proposals. There is no explicit go-shop provision mentioned\u30100\u2020input.pdf\u3011\u30102\u2020input.pdf\u3011.",
      "financing": "Compass has secured a debt financing commitment of up to $750 million in the form of a 364-day senior secured bridge loan facility to refinance existing indebtedness of Anywhere and pay related fees and expenses\u30107\u2020input.pdf\u3011.",
      "support_agreements": "Key stockholders of Compass (holding ~29.6% of voting power) and Anywhere (holding ~8.7% of Anywhere common stock) have entered into voting and support agreements to vote in favor of the merger and not transfer their shares, subject to certain exceptions\u30106\u2020input.pdf\u3011\u301013\u2020input.pdf\u3011."
    },
    "reasoning": "The analysis focused on extracting key economic and structural terms from the merger agreement while excluding boilerplate legal language. The approach involved identifying the transaction structure, purchase price, closing conditions, termination provisions, MAC clauses, and other material terms such as financing and support agreements. Each term was validated by cross-referencing specific sections of the agreement to ensure accuracy and completeness.",
    "reasoning_steps": [
      "Step 1: Located the transaction structure and parties involved by reviewing the introductory sections of the merger agreement, which detailed the merger type, consideration, and parties\u30100\u2020input.pdf\u3011\u30103\u2020input.pdf\u3011.",
      "Step 2: Extracted the purchase price and per-share consideration from the sections describing the merger consideration and exchange ratio\u30103\u2020input.pdf\u3011.",
      "Step 3: Identified conditions to closing by reviewing the sections outlining the requirements for completing the merger, including regulatory approvals and stockholder votes\u30102\u2020input.pdf\u3011\u30108\u2020input.pdf\u3011.",
      "Step 4: Validated termination provisions, including fees and triggers, by examining the termination rights and associated financial obligations\u30101\u2020input.pdf\u3011\u30104\u2020input.pdf\u3011.",
      "Step 5: Reviewed MAC provisions and noted the absence of explicit carve-outs in the summary, as these are typically detailed in the full agreement\u30102\u2020input.pdf\u3011.",
      "Step 6: Noted other material terms such as non-solicitation provisions, financing commitments, and support agreements by analyzing relevant sections of the document\u30100\u2020input.pdf\u3011\u30102\u2020input.pdf\u3011\u30106\u2020input.pdf\u3011\u30107\u2020input.pdf\u3011\u301013\u2020input.pdf\u3011."
    ]
  },
  "stop_reason": "end_turn",
  "usage": {
    "input_tokens": 21291,
    "output_tokens": 1548,
    "latency_ms": 27880.557775497437
  }
}