{
  "task_id": "e-011",
  "model": "Mistral-Large-3",
  "timestamp": "2026-01-18T13:04:17.839923",
  "input_files": [
    "input.xlsx"
  ],
  "output_files": [],
  "raw_response": "The provided `Debt` sheet structure includes:\n\n- **Rows**: Specific debt instruments and summary totals at the bottom (e.g., Total Debt, Short-Term Borrowings, Short-Term Debt, Total Long-Term Debt).\n- **Columns**: Periods from 1Q22 through 2025, with the task focusing on 3Q22 to 2025 (columns G to X).\n\n### Next Steps\n\nTo proceed with the task, I need the following details from Carnival Corp's 10-Q and 10-K filings:\n\n1. **Debt by Instrument and Maturity**: Extract the amounts for each debt instrument and their maturities from the filings.\n2. **Mapping to Template**: Map these instruments to the corresponding rows in the template.\n3. **Populate Values**: Enter the hardcoded values in the appropriate cells for 3Q22 through 2025.\n\nSince I don't have direct access to the filings, I will outline the process for you to extract and input the data:\n\n### Process to Complete the Debt Schedule\n\n1. **Locate Debt Tables in Filings**:\n   - Review Carnival Corp's 10-Q for Q3 2022 and subsequent 10-K and 10-Q filings through 2025.\n   - Identify tables detailing debt by instrument and maturity.\n\n2. **Map Instruments to Template**:\n   - Match each debt instrument from the filings to the corresponding row in the `Debt` sheet.\n   - Ensure the maturity dates align with the correct period columns (3Q22 to 2025).\n\n3. **Populate Hardcoded Values**:\n   - Enter the debt amounts in USD millions for each period, using blue font for hardcoded numbers.\n   - Preserve all formulas and formatting.\n\n4. **Validate Totals**:\n   - Confirm that the totals in the template reconcile with the filings for each period.\n\n### JSON Summary Structure\n\nOnce the Excel file is updated, I will generate the JSON summary as follows:\n\n```json\n{\n  \"total_debt_3q22\": \"Value from Debt!G95\",\n  \"total_debt_2023\": \"Value from Debt!N95\",\n  \"total_debt_2025\": \"Value from Debt!X95\",\n  \"short_term_borrowings_3q22\": \"Value from Debt!G96\",\n  \"short_term_borrowings_2023\": \"Value from Debt!N96\",\n  \"short_term_borrowings_2025\": \"Value from Debt!X96\",\n  \"short_term_debt_3q22\": \"Value from Debt!G97\",\n  \"short_term_debt_2023\": \"Value from Debt!N97\",\n  \"short_term_debt_2025\": \"Value from Debt!X97\",\n  \"formatting\": \"\",\n  \"reasoning_steps\": [\n    \"Step 1: Extracted debt tables from Carnival Corp 10-Q and 10-K filings for 3Q22 through 2025.\",\n    \"Step 2: Mapped each debt instrument to the corresponding row in the template, aligning maturities with period columns.\",\n    \"Step 3: Validated totals by reconciling the template with reported figures in the filings.\"\n  ]\n}\n```\n\n### Action Required\n\nPlease provide the specific debt amounts and maturities from the Carnival Corp filings for 3Q22 through 2025, or upload the relevant sections of the filings. Once I have this data, I can populate the Excel sheet and finalize the deliverables.\nThe provided `Debt` sheet structure includes:\n\n- **Rows**: Specific debt instruments and summary totals at the bottom (e.g., Total Debt, Short-Term Borrowings, Short-Term Debt, Total Long-Term Debt).\n- **Columns**: Periods from 1Q22 through 2025, with the task focusing on 3Q22 to 2025 (columns G to X).\n\n### Next Steps\n\nTo proceed with the task, I need the following details from Carnival Corp's 10-Q and 10-K filings:\n\n1. **Debt by Instrument and Maturity**: Extract the amounts for each debt instrument and their maturities from the filings.\n2. **Mapping to Template**: Map these instruments to the corresponding rows in the template.\n3. **Populate Values**: Enter the hardcoded values in the appropriate cells for 3Q22 through 2025.\n\nSince I don't have direct access to the filings, I will outline the process for you to extract and input the data:\n\n### Process to Complete the Debt Schedule\n\n1. **Locate Debt Tables in Filings**:\n   - Review Carnival Corp's 10-Q for Q3 2022 and subsequent 10-K and 10-Q filings through 2025.\n   - Identify tables detailing debt by instrument and maturity.\n\n2. **Map Instruments to Template**:\n   - Match each debt instrument from the filings to the corresponding row in the `Debt` sheet.\n   - Ensure the maturity dates align with the correct period columns (3Q22 to 2025).\n\n3. **Populate Hardcoded Values**:\n   - Enter the debt amounts in USD millions for each period, using blue font for hardcoded numbers.\n   - Preserve all formulas and formatting.\n\n4. **Validate Totals**:\n   - Confirm that the totals in the template reconcile with the filings for each period.\n\n### JSON Summary Structure\n\nOnce the Excel file is updated, I will generate the JSON summary as follows:\n\n```json\n{\n  \"total_debt_3q22\": \"Value from Debt!G95\",\n  \"total_debt_2023\": \"Value from Debt!N95\",\n  \"total_debt_2025\": \"Value from Debt!X95\",\n  \"short_term_borrowings_3q22\": \"Value from Debt!G96\",\n  \"short_term_borrowings_2023\": \"Value from Debt!N96\",\n  \"short_term_borrowings_2025\": \"Value from Debt!X96\",\n  \"short_term_debt_3q22\": \"Value from Debt!G97\",\n  \"short_term_debt_2023\": \"Value from Debt!N97\",\n  \"short_term_debt_2025\": \"Value from Debt!X97\",\n  \"formatting\": \"\",\n  \"reasoning_steps\": [\n    \"Step 1: Extracted debt tables from Carnival Corp 10-Q and 10-K filings for 3Q22 through 2025.\",\n    \"Step 2: Mapped each debt instrument to the corresponding row in the template, aligning maturities with period columns.\",\n    \"Step 3: Validated totals by reconciling the template with reported figures in the filings.\"\n  ]\n}\n```\n\n### Action Required\n\nPlease provide the specific debt amounts and maturities from the Carnival Corp filings for 3Q22 through 2025, or upload the relevant sections of the filings. Once I have this data, I can populate the Excel sheet and finalize the deliverables.",
  "parsed_response": {
    "total_debt_3q22": "Value from Debt!G95",
    "total_debt_2023": "Value from Debt!N95",
    "total_debt_2025": "Value from Debt!X95",
    "short_term_borrowings_3q22": "Value from Debt!G96",
    "short_term_borrowings_2023": "Value from Debt!N96",
    "short_term_borrowings_2025": "Value from Debt!X96",
    "short_term_debt_3q22": "Value from Debt!G97",
    "short_term_debt_2023": "Value from Debt!N97",
    "short_term_debt_2025": "Value from Debt!X97",
    "formatting": "",
    "reasoning_steps": [
      "Step 1: Extracted debt tables from Carnival Corp 10-Q and 10-K filings for 3Q22 through 2025.",
      "Step 2: Mapped each debt instrument to the corresponding row in the template, aligning maturities with period columns.",
      "Step 3: Validated totals by reconciling the template with reported figures in the filings."
    ]
  },
  "stop_reason": "end_turn",
  "usage": {
    "input_tokens": 3839,
    "output_tokens": 953,
    "latency_ms": 19632.697105407715
  }
}