{
  "task_id": "e-015",
  "model": "Mistral-Large-3",
  "timestamp": "2026-01-21T13:26:59.907328",
  "input_files": [],
  "output_files": [],
  "raw_response": "Here is the JSON object with potential U.S. biotech M&A targets as of January 1, 2026, based on public data and strategic rationale:\n\n```json\n{\n  \"tier_1_targets\": [\n    {\n      \"name\": \"Alnylam Pharmaceuticals\",\n      \"ticker\": \"ALNY\",\n      \"market_cap_usd_b\": \"47.0\",\n      \"probability\": \"30-50%\",\n      \"strategic_rationale\": \"Leader in RNAi therapeutics with a robust pipeline in genetic medicines, rare diseases, and cardiometabolic indications. Strategic fit for large pharma seeking to bolster RNA-based platforms.\",\n      \"source\": \"https://www.macrotrends.net/stocks/charts/ALNY/alnylam-pharmaceuticals/market-cap\"\n    },\n    {\n      \"name\": \"Sarepta Therapeutics\",\n      \"ticker\": \"SRPT\",\n      \"market_cap_usd_b\": \"2.2\",\n      \"probability\": \"30-50%\",\n      \"strategic_rationale\": \"Dominant player in Duchenne muscular dystrophy (DMD) with a growing gene therapy pipeline. Attractive for acquirers seeking leadership in rare genetic diseases.\",\n      \"source\": \"https://companiesmarketcap.com/sarepta-therapeutics/marketcap/\"\n    },\n    {\n      \"name\": \"Beam Therapeutics\",\n      \"ticker\": \"BEAM\",\n      \"market_cap_usd_b\": \"3.6\",\n      \"probability\": \"30-50%\",\n      \"strategic_rationale\": \"Pioneer in base editing, a next-generation CRISPR modality. Strategic fit for large biopharma aiming to lead in precision genetic medicine.\",\n      \"source\": \"https://pitchbook.com/profiles/company/227333-71\"\n    },\n    {\n      \"name\": \"Arcellx\",\n      \"ticker\": \"ACLX\",\n      \"market_cap_usd_b\": \"4.5\",\n      \"probability\": \"30-50%\",\n      \"strategic_rationale\": \"Innovator in novel CAR-T and adaptive cell therapies, with a platform that could enhance existing cell therapy franchises.\",\n      \"source\": \"https://pitchbook.com/profiles/company/151213-33\"\n    },\n    {\n      \"name\": \"Kymera Therapeutics\",\n      \"ticker\": \"KYMR\",\n      \"market_cap_usd_b\": \"5.9\",\n      \"probability\": \"30-50%\",\n      \"strategic_rationale\": \"Leader in targeted protein degradation, a high-potential modality for oncology and immune-mediated diseases. Strong platform fit for large biopharma.\",\n      \"source\": \"https://www.investing.com/pro/NASDAQGM:KYMR/explorer/marketcap\"\n    }\n  ],\n  \"tier_2_targets\": [\n    {\n      \"name\": \"Iovance Biotherapeutics\",\n      \"ticker\": \"IOVA\",\n      \"market_cap_usd_b\": \"1.1\",\n      \"probability\": \"15-30%\",\n      \"strategic_rationale\": \"First-in-class tumor-infiltrating lymphocyte (TIL) therapies for solid tumors. High-risk, high-reward profile with potential to transform immuno-oncology.\",\n      \"source\": \"https://seekingalpha.com/article/4856106-iovance-biotherapeutics-stock-upcoming-catalysts-bright-prospects-for-2026\"\n    },\n    {\n      \"name\": \"Arvinas\",\n      \"ticker\": \"ARVN\",\n      \"market_cap_usd_b\": \"0.8\",\n      \"probability\": \"15-30%\",\n      \"strategic_rationale\": \"Co-inventor of PROTAC technology, with a pipeline in oncology and neurodegeneration. Platform value for acquirers seeking protein degradation expertise.\",\n      \"source\": \"https://www.macrotrends.net/stocks/charts/ARVN/arvinas/market-cap\"\n    },\n    {\n      \"name\": \"Replimune\",\n      \"ticker\": \"REPL\",\n      \"market_cap_usd_b\": \"0.7\",\n      \"probability\": \"15-30%\",\n      \"strategic_rationale\": \"Oncolytic immunotherapy platform with potential to enhance existing immuno-oncology franchises. Early-stage but differentiated technology.\",\n      \"source\": \"https://www.cnbc.com/quotes/REPL\"\n    },\n    {\n      \"name\": \"CRISPR Therapeutics\",\n      \"ticker\": \"CRSP\",\n      \"market_cap_usd_b\": \"4.2\",\n      \"probability\": \"15-30%\",\n      \"strategic_rationale\": \"Co-founder of CRISPR-Cas9 gene editing, with a strong pipeline in hemoglobinopathies and immuno-oncology. Platform value for large biopharma seeking gene editing leadership.\",\n      \"source\": \"https://companiesmarketcap.com/crispr-therapeutics/marketcap/\"\n    },\n    {\n      \"name\": \"Dyno Therapeutics\",\n      \"ticker\": \"Private\",\n      \"market_cap_usd_b\": \"N/A\",\n      \"probability\": \"15-30%\",\n      \"strategic_rationale\": \"AI-driven AAV vector engineering for gene therapy. High-value platform for acquirers seeking to optimize gene delivery and reduce immunogenicity.\",\n      \"source\": \"https://a16z.com/announcement/investing-in-dyno-therapeutics/\"\n    }\n  ],\n  \"selection_methodology\": \"Targets were selected based on (1) strategic relevance to large biopharma acquirers, (2) pipeline maturity and modality/platform fit, (3) market cap and public trading status, and (4) recent M&A trends in biotech. Tier 1 targets are larger, more mature, and have higher strategic fit; Tier 2 targets are earlier-stage or have more niche platforms.\",\n  \"source_urls\": [\n    \"https://www.genengnews.com/a-lists/top-25-biotech-companies-heading-into-2026/\",\n    \"https://companiesmarketcap.com/biotech/largest-companies-by-market-cap/\",\n    \"https://www.macrotrends.net/stocks/charts/ALNY/alnylam-pharmaceuticals/market-cap\",\n    \"https://companiesmarketcap.com/sarepta-therapeutics/marketcap/\",\n    \"https://pitchbook.com/profiles/company/227333-71\",\n    \"https://pitchbook.com/profiles/company/151213-33\",\n    \"https://www.investing.com/pro/NASDAQGM:KYMR/explorer/marketcap\",\n    \"https://seekingalpha.com/article/4856106-iovance-biotherapeutics-stock-upcoming-catalysts-bright-prospects-for-2026\",\n    \"https://www.macrotrends.net/stocks/charts/ARVN/arvinas/market-cap\",\n    \"https://www.cnbc.com/quotes/REPL\",\n    \"https://companiesmarketcap.com/crispr-therapeutics/marketcap/\",\n    \"https://a16z.com/announcement/investing-in-dyno-therapeutics/\"\n  ],\n  \"reasoning_steps\": [\n    \"Step 1: Screened the universe of U.S.-listed biotech companies for strategic relevance, focusing on companies with advanced pipelines, novel modalities, or platform technologies attractive to large biopharma acquirers.\",\n    \"Step 2: Assigned Tier 1 status to companies with (a) market caps between $2B and $50B, (b) late-stage or commercial assets, and (c) high strategic fit (e.g., RNAi, gene editing, cell therapy, protein degradation).\",\n    \"Step 3: Assigned Tier 2 status to companies with (a) market caps below $2B, (b) earlier-stage pipelines, or (c) more niche or high-risk platforms (e.g., TIL therapy, oncolytic immunotherapy, AI-driven gene therapy).\",\n    \"Step 4: Verified market caps using public sources and cross-checked for consistency.\"\n  ]\n}\n```",
  "parsed_response": {
    "tier_1_targets": [
      {
        "name": "Alnylam Pharmaceuticals",
        "ticker": "ALNY",
        "market_cap_usd_b": "47.0",
        "probability": "30-50%",
        "strategic_rationale": "Leader in RNAi therapeutics with a robust pipeline in genetic medicines, rare diseases, and cardiometabolic indications. Strategic fit for large pharma seeking to bolster RNA-based platforms.",
        "source": "https://www.macrotrends.net/stocks/charts/ALNY/alnylam-pharmaceuticals/market-cap"
      },
      {
        "name": "Sarepta Therapeutics",
        "ticker": "SRPT",
        "market_cap_usd_b": "2.2",
        "probability": "30-50%",
        "strategic_rationale": "Dominant player in Duchenne muscular dystrophy (DMD) with a growing gene therapy pipeline. Attractive for acquirers seeking leadership in rare genetic diseases.",
        "source": "https://companiesmarketcap.com/sarepta-therapeutics/marketcap/"
      },
      {
        "name": "Beam Therapeutics",
        "ticker": "BEAM",
        "market_cap_usd_b": "3.6",
        "probability": "30-50%",
        "strategic_rationale": "Pioneer in base editing, a next-generation CRISPR modality. Strategic fit for large biopharma aiming to lead in precision genetic medicine.",
        "source": "https://pitchbook.com/profiles/company/227333-71"
      },
      {
        "name": "Arcellx",
        "ticker": "ACLX",
        "market_cap_usd_b": "4.5",
        "probability": "30-50%",
        "strategic_rationale": "Innovator in novel CAR-T and adaptive cell therapies, with a platform that could enhance existing cell therapy franchises.",
        "source": "https://pitchbook.com/profiles/company/151213-33"
      },
      {
        "name": "Kymera Therapeutics",
        "ticker": "KYMR",
        "market_cap_usd_b": "5.9",
        "probability": "30-50%",
        "strategic_rationale": "Leader in targeted protein degradation, a high-potential modality for oncology and immune-mediated diseases. Strong platform fit for large biopharma.",
        "source": "https://www.investing.com/pro/NASDAQGM:KYMR/explorer/marketcap"
      }
    ],
    "tier_2_targets": [
      {
        "name": "Iovance Biotherapeutics",
        "ticker": "IOVA",
        "market_cap_usd_b": "1.1",
        "probability": "15-30%",
        "strategic_rationale": "First-in-class tumor-infiltrating lymphocyte (TIL) therapies for solid tumors. High-risk, high-reward profile with potential to transform immuno-oncology.",
        "source": "https://seekingalpha.com/article/4856106-iovance-biotherapeutics-stock-upcoming-catalysts-bright-prospects-for-2026"
      },
      {
        "name": "Arvinas",
        "ticker": "ARVN",
        "market_cap_usd_b": "0.8",
        "probability": "15-30%",
        "strategic_rationale": "Co-inventor of PROTAC technology, with a pipeline in oncology and neurodegeneration. Platform value for acquirers seeking protein degradation expertise.",
        "source": "https://www.macrotrends.net/stocks/charts/ARVN/arvinas/market-cap"
      },
      {
        "name": "Replimune",
        "ticker": "REPL",
        "market_cap_usd_b": "0.7",
        "probability": "15-30%",
        "strategic_rationale": "Oncolytic immunotherapy platform with potential to enhance existing immuno-oncology franchises. Early-stage but differentiated technology.",
        "source": "https://www.cnbc.com/quotes/REPL"
      },
      {
        "name": "CRISPR Therapeutics",
        "ticker": "CRSP",
        "market_cap_usd_b": "4.2",
        "probability": "15-30%",
        "strategic_rationale": "Co-founder of CRISPR-Cas9 gene editing, with a strong pipeline in hemoglobinopathies and immuno-oncology. Platform value for large biopharma seeking gene editing leadership.",
        "source": "https://companiesmarketcap.com/crispr-therapeutics/marketcap/"
      },
      {
        "name": "Dyno Therapeutics",
        "ticker": "Private",
        "market_cap_usd_b": "N/A",
        "probability": "15-30%",
        "strategic_rationale": "AI-driven AAV vector engineering for gene therapy. High-value platform for acquirers seeking to optimize gene delivery and reduce immunogenicity.",
        "source": "https://a16z.com/announcement/investing-in-dyno-therapeutics/"
      }
    ],
    "selection_methodology": "Targets were selected based on (1) strategic relevance to large biopharma acquirers, (2) pipeline maturity and modality/platform fit, (3) market cap and public trading status, and (4) recent M&A trends in biotech. Tier 1 targets are larger, more mature, and have higher strategic fit; Tier 2 targets are earlier-stage or have more niche platforms.",
    "source_urls": [
      "https://www.genengnews.com/a-lists/top-25-biotech-companies-heading-into-2026/",
      "https://companiesmarketcap.com/biotech/largest-companies-by-market-cap/",
      "https://www.macrotrends.net/stocks/charts/ALNY/alnylam-pharmaceuticals/market-cap",
      "https://companiesmarketcap.com/sarepta-therapeutics/marketcap/",
      "https://pitchbook.com/profiles/company/227333-71",
      "https://pitchbook.com/profiles/company/151213-33",
      "https://www.investing.com/pro/NASDAQGM:KYMR/explorer/marketcap",
      "https://seekingalpha.com/article/4856106-iovance-biotherapeutics-stock-upcoming-catalysts-bright-prospects-for-2026",
      "https://www.macrotrends.net/stocks/charts/ARVN/arvinas/market-cap",
      "https://www.cnbc.com/quotes/REPL",
      "https://companiesmarketcap.com/crispr-therapeutics/marketcap/",
      "https://a16z.com/announcement/investing-in-dyno-therapeutics/"
    ],
    "reasoning_steps": [
      "Step 1: Screened the universe of U.S.-listed biotech companies for strategic relevance, focusing on companies with advanced pipelines, novel modalities, or platform technologies attractive to large biopharma acquirers.",
      "Step 2: Assigned Tier 1 status to companies with (a) market caps between $2B and $50B, (b) late-stage or commercial assets, and (c) high strategic fit (e.g., RNAi, gene editing, cell therapy, protein degradation).",
      "Step 3: Assigned Tier 2 status to companies with (a) market caps below $2B, (b) earlier-stage pipelines, or (c) more niche or high-risk platforms (e.g., TIL therapy, oncolytic immunotherapy, AI-driven gene therapy).",
      "Step 4: Verified market caps using public sources and cross-checked for consistency."
    ]
  },
  "stop_reason": "end_turn",
  "usage": {
    "input_tokens": 41915,
    "output_tokens": 8054,
    "latency_ms": 123706.22110366821
  }
}