{
  "task_id": "e-016",
  "model": "Mistral-Large-3",
  "timestamp": "2026-01-21T13:27:48.850598",
  "input_files": [
    "input.pdf"
  ],
  "output_files": [],
  "raw_response": "Given the constraints of the provided 8-K and the absence of the full text of **Exhibit 2.1** (the Merger Agreement), the following is the most precise and structured summary possible based on the available information:\n\n---\n\n```json\n{\n  \"deal_structure\": \"The transaction is structured as a stock-for-stock reverse triangular merger, wherein Velocity Merger Sub, Inc., a wholly-owned subsidiary of Compass, Inc. ('Compass'), will merge with and into Anywhere Real Estate Inc. ('Anywhere'), with Anywhere surviving as a wholly-owned subsidiary of Compass. The form of consideration is 1.436 shares of Compass Class A common stock for each share of Anywhere common stock, plus cash in lieu of fractional shares if applicable. The transaction is intended to qualify as a tax-free reorganization under Section 368(a) of the Internal Revenue Code.\",\n\n  \"purchase_price\": \"The per-share consideration is 1.436 shares of Compass Class A common stock for each share of Anywhere common stock. The total equity value is not explicitly stated in the available excerpts, but can be calculated based on the Exchange Ratio and the fully diluted shares outstanding of Anywhere at the time of the agreement.\",\n\n  \"conditions_to_closing\": [\n    \"Approval of the issuance of Compass shares by a majority of Compass stockholders (the 'Company Stockholder Approval').\",\n    \"Adoption of the Merger Agreement by a majority of Anywhere stockholders (the 'Anywhere Stockholder Approval').\",\n    \"Effectiveness of the registration statement filed by Compass with the SEC for the Compass shares to be issued in the Merger.\",\n    \"Listing approval from the NYSE for the Compass shares to be issued in the Merger.\",\n    \"Expiration or termination of the applicable waiting period under the Hart-Scott-Rodino Antitrust Improvements Act of 1976 ('HSR Act').\",\n    \"Receipt of other required regulatory approvals, with both parties obligated to use 'reasonable best efforts' to obtain such approvals.\"\n  ],\n\n  \"termination_provisions\": {\n    \"termination_rights\": [\n      \"Either party may terminate if the Merger has not closed by September 22, 2026, subject to three automatic three-month extensions if all closing conditions except regulatory approvals are satisfied or waived (the 'Outside Date').\",\n      \"Termination if a final, non-appealable law or order permanently prohibits the Merger.\",\n      \"Termination by Compass if Anywhere stockholder approval is not obtained, or by Anywhere if Compass stockholder approval is not obtained.\",\n      \"Termination for a material uncured breach of representations, warranties, covenants, or agreements by the other party.\",\n      \"Termination by Compass if Anywhere\u2019s board changes its recommendation in favor of the Merger, or by Anywhere if Compass\u2019 board changes its recommendation regarding the issuance of Compass shares.\"\n    ],\n    \"termination_fees\": {\n      \"standard_termination_fee\": \"$200 million payable by the party causing the termination under specified circumstances.\",\n      \"regulatory_termination_fee\": \"$350 million payable by Compass to Anywhere if the Merger Agreement is terminated because required regulatory clearances are not obtained by the Outside Date or if the Merger is permanently enjoined.\"\n    },\n    \"specific_performance\": \"Either party may seek to compel specific performance of the other party\u2019s obligations under the Merger Agreement.\"\n  },\n\n  \"mac_provisions\": {\n    \"definition_scope\": \"The available excerpts do not provide the explicit definition of 'Material Adverse Effect' (MAE) or 'Material Adverse Change' (MAC). However, the agreement references the occurrence of a 'material adverse change' or 'material uncured breach' as a condition that could give rise to termination rights. Typically, MAE definitions in merger agreements exclude general economic, market, or industry conditions, changes in law, acts of war or terrorism, and other broad carve-outs unless disproportionately affecting the target.\",\n    \"key_carve_outs\": \"While the specific carve-outs are not detailed in the provided excerpts, standard MAE carve-outs in M&A agreements often include: changes in general economic or financial market conditions, changes in law or GAAP, natural disasters, acts of war or terrorism, and industry-wide disruptions. The agreement likely follows this convention, but the exact language is not available.\"\n  },\n\n  \"other_material_terms\": {\n    \"non_solicitation\": \"The Merger Agreement includes customary non-solicitation provisions, prohibiting Anywhere and Compass from seeking or encouraging alternative business combination proposals from third parties. No explicit 'go-shop' provision is mentioned in the available excerpts.\",\n    \"financing\": \"No financing contingency is mentioned, consistent with the all-stock nature of the transaction.\"\n  },\n\n  \"reasoning\": \"The summary is derived strictly from the provided 8-K filing and its referenced exhibits. The key economic and structural terms were identified by focusing on sections detailing the transaction structure, consideration, closing conditions, termination rights and fees, and non-solicitation provisions. The absence of the full Merger Agreement (Exhibit 2.1) limits the ability to provide explicit MAE definitions and carve-outs, as well as the precise language of non-solicitation provisions. The analysis prioritized material terms that impact deal economics and protections, excluding boilerplate legal language.\",\n\n  \"reasoning_steps\": [\n    \"Step 1: Reviewed the 8-K filing for sections explicitly detailing the transaction structure, consideration, and parties involved, focusing on Item 1.01 and Exhibit 2.1 references.\",\n    \"Step 2: Extracted purchase price and per-share consideration from the 'Merger Consideration' section, noting the Exchange Ratio and form of consideration.\",\n    \"Step 3: Identified closing conditions by analyzing the 'Conditions to Completing the Merger' section, including stockholder and regulatory approvals.\",\n    \"Step 4: Located termination provisions, including triggers and fees, in the 'Termination Rights and Fees' section, distinguishing between standard and regulatory termination fees.\",\n    \"Step 5: Searched for MAE/MAC definitions and carve-outs, noting their absence in the provided excerpts and inferring standard market practice for such provisions.\",\n    \"Step 6: Confirmed the presence of non-solicitation provisions and the absence of go-shop provisions in the 'Representations and Warranties; Covenants' section.\"\n  ]\n}\n```",
  "parsed_response": {
    "deal_structure": "The transaction is structured as a stock-for-stock reverse triangular merger, wherein Velocity Merger Sub, Inc., a wholly-owned subsidiary of Compass, Inc. ('Compass'), will merge with and into Anywhere Real Estate Inc. ('Anywhere'), with Anywhere surviving as a wholly-owned subsidiary of Compass. The form of consideration is 1.436 shares of Compass Class A common stock for each share of Anywhere common stock, plus cash in lieu of fractional shares if applicable. The transaction is intended to qualify as a tax-free reorganization under Section 368(a) of the Internal Revenue Code.",
    "purchase_price": "The per-share consideration is 1.436 shares of Compass Class A common stock for each share of Anywhere common stock. The total equity value is not explicitly stated in the available excerpts, but can be calculated based on the Exchange Ratio and the fully diluted shares outstanding of Anywhere at the time of the agreement.",
    "conditions_to_closing": [
      "Approval of the issuance of Compass shares by a majority of Compass stockholders (the 'Company Stockholder Approval').",
      "Adoption of the Merger Agreement by a majority of Anywhere stockholders (the 'Anywhere Stockholder Approval').",
      "Effectiveness of the registration statement filed by Compass with the SEC for the Compass shares to be issued in the Merger.",
      "Listing approval from the NYSE for the Compass shares to be issued in the Merger.",
      "Expiration or termination of the applicable waiting period under the Hart-Scott-Rodino Antitrust Improvements Act of 1976 ('HSR Act').",
      "Receipt of other required regulatory approvals, with both parties obligated to use 'reasonable best efforts' to obtain such approvals."
    ],
    "termination_provisions": {
      "termination_rights": [
        "Either party may terminate if the Merger has not closed by September 22, 2026, subject to three automatic three-month extensions if all closing conditions except regulatory approvals are satisfied or waived (the 'Outside Date').",
        "Termination if a final, non-appealable law or order permanently prohibits the Merger.",
        "Termination by Compass if Anywhere stockholder approval is not obtained, or by Anywhere if Compass stockholder approval is not obtained.",
        "Termination for a material uncured breach of representations, warranties, covenants, or agreements by the other party.",
        "Termination by Compass if Anywhere\u2019s board changes its recommendation in favor of the Merger, or by Anywhere if Compass\u2019 board changes its recommendation regarding the issuance of Compass shares."
      ],
      "termination_fees": {
        "standard_termination_fee": "$200 million payable by the party causing the termination under specified circumstances.",
        "regulatory_termination_fee": "$350 million payable by Compass to Anywhere if the Merger Agreement is terminated because required regulatory clearances are not obtained by the Outside Date or if the Merger is permanently enjoined."
      },
      "specific_performance": "Either party may seek to compel specific performance of the other party\u2019s obligations under the Merger Agreement."
    },
    "mac_provisions": {
      "definition_scope": "The available excerpts do not provide the explicit definition of 'Material Adverse Effect' (MAE) or 'Material Adverse Change' (MAC). However, the agreement references the occurrence of a 'material adverse change' or 'material uncured breach' as a condition that could give rise to termination rights. Typically, MAE definitions in merger agreements exclude general economic, market, or industry conditions, changes in law, acts of war or terrorism, and other broad carve-outs unless disproportionately affecting the target.",
      "key_carve_outs": "While the specific carve-outs are not detailed in the provided excerpts, standard MAE carve-outs in M&A agreements often include: changes in general economic or financial market conditions, changes in law or GAAP, natural disasters, acts of war or terrorism, and industry-wide disruptions. The agreement likely follows this convention, but the exact language is not available."
    },
    "other_material_terms": {
      "non_solicitation": "The Merger Agreement includes customary non-solicitation provisions, prohibiting Anywhere and Compass from seeking or encouraging alternative business combination proposals from third parties. No explicit 'go-shop' provision is mentioned in the available excerpts.",
      "financing": "No financing contingency is mentioned, consistent with the all-stock nature of the transaction."
    },
    "reasoning": "The summary is derived strictly from the provided 8-K filing and its referenced exhibits. The key economic and structural terms were identified by focusing on sections detailing the transaction structure, consideration, closing conditions, termination rights and fees, and non-solicitation provisions. The absence of the full Merger Agreement (Exhibit 2.1) limits the ability to provide explicit MAE definitions and carve-outs, as well as the precise language of non-solicitation provisions. The analysis prioritized material terms that impact deal economics and protections, excluding boilerplate legal language.",
    "reasoning_steps": [
      "Step 1: Reviewed the 8-K filing for sections explicitly detailing the transaction structure, consideration, and parties involved, focusing on Item 1.01 and Exhibit 2.1 references.",
      "Step 2: Extracted purchase price and per-share consideration from the 'Merger Consideration' section, noting the Exchange Ratio and form of consideration.",
      "Step 3: Identified closing conditions by analyzing the 'Conditions to Completing the Merger' section, including stockholder and regulatory approvals.",
      "Step 4: Located termination provisions, including triggers and fees, in the 'Termination Rights and Fees' section, distinguishing between standard and regulatory termination fees.",
      "Step 5: Searched for MAE/MAC definitions and carve-outs, noting their absence in the provided excerpts and inferring standard market practice for such provisions.",
      "Step 6: Confirmed the presence of non-solicitation provisions and the absence of go-shop provisions in the 'Representations and Warranties; Covenants' section."
    ]
  },
  "stop_reason": "end_turn",
  "usage": {
    "input_tokens": 33480,
    "output_tokens": 3964,
    "latency_ms": 40295.817852020264
  }
}